language,model,test_id,expected_text,ASR_text,WER_percent,generation_time,audio_duration,RTF,peak,clipping,clipping_samples,speaker_similarity,manual_naturalness,manual_pronunciation,status,output_path,notes
English,MMS-TTS,en_clone_01_greeting,Hello and welcome. I am your voice assistant today.,Hello and welcome. I am your voice assistant today,0,2.217,3.712,0.597,0.782,False,0,,,,completed,outputs\mms\english\final\en_clone_01_greeting.wav,"source=results\mms_english_evaluation.csv; fixed-speaker baseline, not voice cloning; speaker similarity not applicable; manual MOS pending"
English,MMS-TTS,en_clone_02_technology,Artificial intelligence helps teams answer customers faster and more clearly.,Artificial intelligence helps. Teams answer customers faster and more clearly.,0,2.39,5.584,0.428,0.947,False,0,,,,completed,outputs\mms\english\final\en_clone_02_technology.wav,"source=results\mms_english_evaluation.csv; fixed-speaker baseline, not voice cloning; speaker similarity not applicable; manual MOS pending"
English,MMS-TTS,en_clone_03_conversational,"Sure, I can help with that. Please tell me what you need.","Sure, I can help with that. Please tell me what you need.",0,1.527,3.36,0.454,0.906,False,0,,,,completed,outputs\mms\english\final\en_clone_03_conversational.wav,"source=results\mms_english_evaluation.csv; fixed-speaker baseline, not voice cloning; speaker similarity not applicable; manual MOS pending"
English,MMS-TTS,en_clone_04_numbers,"Your confirmation number is two zero six five, and the meeting starts at three thirty.",Your confirmation number is 2065 and the meeting starts at 330,40,2.19,5.744,0.381,0.936,False,0,,,,completed,outputs\mms\english\final\en_clone_04_numbers.wav,"source=results\mms_english_evaluation.csv; fixed-speaker baseline, not voice cloning; speaker similarity not applicable; manual MOS pending"
English,MMS-TTS,en_clone_05_expressive,That is wonderful news. I am really glad everything worked out.,That is wonderful news. I am really glad everything worked out.,0,1.914,4.656,0.411,0.847,False,0,,,,completed,outputs\mms\english\final\en_clone_05_expressive.wav,"source=results\mms_english_evaluation.csv; fixed-speaker baseline, not voice cloning; speaker similarity not applicable; manual MOS pending"
English,NeuTTS,air_01_greeting,"Hello, welcome to Infinia. I am ready to help you today.",Hello welcome to Incident EO. I am ready to help you today.,18.182,86.042,4.26,20.198,0.594,False,0,0.542,,,completed,outputs\neutts\english\final\air_01_greeting.wav,source=results\neutts_english_evaluation.csv; manual MOS pending
English,NeuTTS,air_02_identity,"My name is Ratan Jyoti, and I enjoy building practical artificial intelligence systems.",My name is Ratan Gyoti and I enjoy building practical artificial intelligence systems.,7.692,105.631,5.68,18.597,0.487,False,0,0.542,,,completed,outputs\neutts\english\final\air_02_identity.wav,source=results\neutts_english_evaluation.csv; manual MOS pending
English,NeuTTS,air_03_support,Thank you for contacting customer support. I have reviewed your request and will guide you through the next steps.,Thank you for contacting customer support. I have reviewed your request and will guide you through the next steps.,0,112.106,6.46,17.354,0.821,False,0,0.542,,,completed,outputs\neutts\english\final\air_03_support.wav,source=results\neutts_english_evaluation.csv; manual MOS pending
English,NeuTTS,air_04_numbers,"Your order number is five eight two four, and it will arrive on July twenty-first.",Your order number is 5824 and it will arrive on July 21st.,37.5,53.812,6.22,8.651,0.675,False,0,0.542,,,completed,outputs\neutts\english\final\air_04_numbers.wav,source=results\neutts_english_evaluation.csv; manual MOS pending
English,NeuTTS,air_05_expressive,"That is wonderful news! Everything worked correctly, and I hope you have a great day.","that is wonderful news, everything worked correctly and I hope you have a great day.",0,52.805,6.04,8.742,0.753,False,0,0.542,,,completed,outputs\neutts\english\final\air_05_expressive.wav,source=results\neutts_english_evaluation.csv; manual MOS pending
Hindi,MMS-TTS,hi_clone_01_greeting,"नमस्ते, आपका स्वागत है। मैं आज आपकी आवाज़ सहायक हूँ।","नमस्ते आख का स्वाखत है, मैं आज आप की अवाज सहाएक हूँ",70,2.306,4.64,0.497,0.838,False,0,,,,completed,outputs\mms\hindi\final\hi_clone_01_greeting.wav,"source=results\mms_hindi_evaluation.csv; fixed-speaker baseline, not voice cloning; speaker similarity not applicable; manual MOS pending"
Hindi,MMS-TTS,hi_clone_02_technology,कृत्रिम बुद्धिमत्ता ग्राहकों को तेज़ और स्पष्ट उत्तर देने में मदद करती है।,खिरित्रीं भुदीमत्ता गहाकों को तेज और स्पाष्ट कुतर देने में माडद करती है,38.462,2.165,5.312,0.408,0.9,False,0,,,,completed,outputs\mms\hindi\final\hi_clone_02_technology.wav,"source=results\mms_hindi_evaluation.csv; fixed-speaker baseline, not voice cloning; speaker similarity not applicable; manual MOS pending"
Hindi,MMS-TTS,hi_clone_03_conversational,"ज़रूर, मैं इसमें मदद कर सकता हूँ। कृपया अपनी ज़रूरत बताइए।","जरूर मैं इस में मदद कर सक्ता हूँ, क्रपया अपनी जरूनत बताये",45.455,2.203,5.12,0.43,0.931,False,0,,,,completed,outputs\mms\hindi\final\hi_clone_03_conversational.wav,"source=results\mms_hindi_evaluation.csv; fixed-speaker baseline, not voice cloning; speaker similarity not applicable; manual MOS pending"
Hindi,MMS-TTS,hi_clone_04_numbers,"आपका पुष्टिकरण नंबर दो शून्य छह पांच है, और बैठक साढ़े तीन बजे शुरू होगी।","अपका पुष्टी करन नान्वबद दो शुने चा पाज है, और बैक यक साए तीन बजे शुरू होगी.",66.667,2.477,6.336,0.391,0.944,False,0,,,,completed,outputs\mms\hindi\final\hi_clone_04_numbers.wav,"source=results\mms_hindi_evaluation.csv; fixed-speaker baseline, not voice cloning; speaker similarity not applicable; manual MOS pending"
Hindi,MMS-TTS,hi_clone_05_expressive,यह बहुत अच्छी खबर है। मुझे खुशी है कि सब ठीक रहा।,"ये बहुत अची खवर है, मुझे खुशी है कि सब थी का",41.667,1.771,4.624,0.383,0.903,False,0,,,,completed,outputs\mms\hindi\final\hi_clone_05_expressive.wav,"source=results\mms_hindi_evaluation.csv; fixed-speaker baseline, not voice cloning; speaker similarity not applicable; manual MOS pending"
Hindi,Chatterbox,hi_clone_01_greeting,"नमस्ते, आपका स्वागत है। मैं आज आपकी आवाज़ सहायक हूँ।","नमस्ते, आपका स्वागत है, मैं आज आपकी अवास सहाया कूँ",30,178.035,6.16,28.902,1,True,27,0.738,,,completed,outputs\chatterbox\hindi\final\hi_clone_01_greeting.wav,source=results\chatterbox_hindi_evaluation.csv; manual MOS pending
Hindi,Chatterbox,hi_clone_02_technology,कृत्रिम बुद्धिमत्ता ग्राहकों को तेज़ और स्पष्ट उत्तर देने में मदद करती है।,क्रित्रिन बुद्दी मत्ता ग्राहको को तेज और स्पष्ट उत्टर देने में मदध करती है,38.462,59.241,6.36,9.315,0.964,False,0,0.738,,,completed,outputs\chatterbox\hindi\final\hi_clone_02_technology.wav,source=results\chatterbox_hindi_evaluation.csv; manual MOS pending
Hindi,Chatterbox,hi_clone_03_conversational,"ज़रूर, मैं इसमें मदद कर सकता हूँ। कृपया अपनी ज़रूरत बताइए।",मैं इस में मदद कर सकता हूं क्रिपिया अपनी ज़रूरत बताएए,45.455,46.099,4.64,9.935,0.852,False,0,0.738,,,completed,outputs\chatterbox\hindi\final\hi_clone_03_conversational.wav,source=results\chatterbox_hindi_evaluation.csv; manual MOS pending
Hindi,Chatterbox,hi_clone_04_numbers,"आपका पुष्टिकरण नंबर दो शून्य छह पांच है, और बैठक साढ़े तीन बजे शुरू होगी।",अपका पुष्टिकरर नमबर दो शूँन्या चै पाई चै और वेट्ख सार्डे तीन बजी शुरू होगी,53.333,215.873,5.56,38.826,1,True,3,0.738,,,completed,outputs\chatterbox\hindi\final\hi_clone_04_numbers.wav,source=results\chatterbox_hindi_evaluation.csv; manual MOS pending
Hindi,Chatterbox,hi_clone_05_expressive,यह बहुत अच्छी खबर है। मुझे खुशी है कि सब ठीक रहा।,"यहाँ बहुत अच्छी कबर है, मुझे खुशी है कि सब छीक रहा.",16.667,45.33,5.6,8.095,0.803,False,0,0.738,,,completed,outputs\chatterbox\hindi\final\hi_clone_05_expressive.wav,source=results\chatterbox_hindi_evaluation.csv; manual MOS pending
Hindi,IndicF5,hi_clone_01_greeting,"नमस्ते, आपका स्वागत है। मैं आज आपकी आवाज़ सहायक हूँ।",सस्वाशल्निया फ़ष्चन्से सरे एवशूँजन नमस्ते आपका स्वागत है मैं आज आपकी आवाज सायग हूँ,50,297.668,7.125,41.778,0.95,False,0,,,,completed,,source=results\indicf5_hindi_initial_test.csv; initial one-sample test only; do not compare as a five-sample benchmark; manual MOS pending
Arabic,XTTS-v2,ar_clone_01_greeting,مَرْحَبًا بِكَ. أَنَا مُسَاعِدُكَ الصَّوْتِيُّ، وَيَسْعَدُنِي أَنْ أُسَاعِدَكَ الْيَوْمَ.,مرحبا بك أنا مساعدك الصوتي ويسعدني أن أساعدك اليوم,0,20.974,6.497,3.228,0.95,False,0,0.624,,,success,outputs\xtts\arabic\ar_clone_01_greeting.wav,source=results\xtts_arabic_evaluation.csv; manual MOS pending
Arabic,XTTS-v2,ar_clone_02_technology,تُسَاعِدُ تِقْنِيَاتُ الذَّكَاءِ الِاصْطِنَاعِيِّ عَلَى تَحْسِينِ الْخَدَمَاتِ وَتَسْرِيعِ إِنْجَازِ الْمَهَامِّ.,تساعد تقنيات الذكاء الإصطناعي على تحسين الخدمات وتسريع إنجاز المهم؟,10,20.759,6.401,3.243,0.95,False,0,0.624,,,success,outputs\xtts\arabic\ar_clone_02_technology.wav,source=results\xtts_arabic_evaluation.csv; manual MOS pending
Arabic,XTTS-v2,ar_clone_03_conversational,بِالتَّأْكِيدِ، يُمْكِنُنِي مُسَاعَدَتُكَ فِي ذَلِكَ. أَخْبِرْنِي فَقَطْ بِمَا تُرِيدُ أَنْ تَفْعَلَ.,للتأكيد يمكنني مساعدتك في ذلك أخبرني فقط بما تريد أن تفعل,9.091,21.015,6.817,3.083,0.95,False,0,0.611,,,success,outputs\xtts\arabic\ar_clone_03_conversational.wav,source=results\xtts_arabic_evaluation.csv; manual MOS pending
Arabic,XTTS-v2,ar_clone_04_numbers,تَمَّ تَسْجِيلُ طَلَبِكَ بِرَقْمِ أَلْفَيْنِ وَسِتَّةٍ وَعِشْرِينَ، وَسَيَتِمُّ تَحْدِيثُهُ فِي السَّاعَةِ الثَّالِثَةِ وَالنِّصْفِ.,تم تسجيل طلبك برقم ألفين وستة وعشرين وسيتم تحدثه في الساعة الثالثة والنصف,7.692,25.7,7.937,3.238,0.95,False,0,0.616,,,success,outputs\xtts\arabic\ar_clone_04_numbers.wav,source=results\xtts_arabic_evaluation.csv; manual MOS pending
Arabic,XTTS-v2,ar_clone_05_expressive,هَذَا خَبَرٌ رَائِعٌ! لَقَدْ أَكْمَلْتَ الْمَهَمَّةَ بِنَجَاحٍ، وَالْآنَ يُمْكِنُكَ الِانْتِقَالُ إِلَى الْخُطْوَةِ التَّالِيَةِ.,هذا خبر رائع لقد أكملت المهمة بنجاح والآن يمكنك الانتقال إلى الخطوة التالية,0,24.737,7.425,3.332,0.95,False,0,0.616,,,success,outputs\xtts\arabic\ar_clone_05_expressive.wav,source=results\xtts_arabic_evaluation.csv; manual MOS pending
Arabic,Chatterbox,ar_clone_01_greeting,مَرْحَبًا بِكَ. أَنَا مُسَاعِدُكَ الصَّوْتِيُّ، وَيَسْعَدُنِي أَنْ أُسَاعِدَكَ الْيَوْمَ.,مرحبا بك أنا مساعدك الصوتي ويسعدني أن أساعدك اليوم,0,82.333,5.76,14.294,0.95,False,0,0.649,,,completed,outputs\chatterbox\arabic\ar_clone_01_greeting.wav,source=results\chatterbox_arabic_evaluation.csv; manual MOS pending
Arabic,Chatterbox,ar_clone_02_technology,تُسَاعِدُ تِقْنِيَاتُ الذَّكَاءِ الِاصْطِنَاعِيِّ عَلَى تَحْسِينِ الْخَدَمَاتِ وَتَسْرِيعِ إِنْجَازِ الْمَهَامِّ.,تساعد تقنيات الذكاء الاصطنعي على تحسين خدمات وتسريع إنجاز المهامي,30,53.925,6,8.987,0.95,False,0,0.624,,,completed,outputs\chatterbox\arabic\ar_clone_02_technology.wav,source=results\chatterbox_arabic_evaluation.csv; manual MOS pending
Arabic,Chatterbox,ar_clone_03_conversational,بِالتَّأْكِيدِ، يُمْكِنُنِي مُسَاعَدَتُكَ فِي ذَلِكَ. أَخْبِرْنِي فَقَطْ بِمَا تُرِيدُ أَنْ تَفْعَلَ.,بالتأكيد يمكنني مساعدتك في ذلك أخبرني فقط بما تريد أن تفعله,9.091,103.78,6.52,15.917,0.95,False,0,0.698,,,completed,outputs\chatterbox\arabic\ar_clone_03_conversational.wav,source=results\chatterbox_arabic_evaluation.csv; manual MOS pending
Arabic,Chatterbox,ar_clone_04_numbers,تَمَّ تَسْجِيلُ طَلَبِكَ بِرَقْمِ أَلْفَيْنِ وَسِتَّةٍ وَعِشْرِينَ، وَسَيَتِمُّ تَحْدِيثُهُ فِي السَّاعَةِ الثَّالِثَةِ وَالنِّصْفِ.,تم تسجير طلبك برقم 2026 وسيتم تحديثه في الساعة الثالثة والنصفة,38.462,97.588,9,10.843,0.95,False,0,0.679,,,completed,outputs\chatterbox\arabic\ar_clone_04_numbers.wav,source=results\chatterbox_arabic_evaluation.csv; manual MOS pending
Arabic,Chatterbox,ar_clone_05_expressive,هَذَا خَبَرٌ رَائِعٌ! لَقَدْ أَكْمَلْتَ الْمَهَمَّةَ بِنَجَاحٍ، وَالْآنَ يُمْكِنُكَ الِانْتِقَالُ إِلَى الْخُطْوَةِ التَّالِيَةِ.,هذا خبر رائع لقد أكملت المهمة بنجاح و الآن يمكنك الانتقال إلى الخبوة التالية,23.077,109.422,10.44,10.481,0.95,False,0,0.716,,,completed,outputs\chatterbox\arabic\ar_clone_05_expressive.wav,source=results\chatterbox_arabic_evaluation.csv; manual MOS pending
